{
  "id": "quotation.p_selfcheck",
  "mechanism": "Agent's own check flags a draft that breaks a limit or register entry it can read.",
  "measures": "Nothing measured. A declared assumption.",
  "simulator_parameter": "p_selfcheck",
  "estimable": "no",
  "estimable_note": "No evidence yet. No estimate planned this round.",
  "value": {
    "unit": "probability",
    "range": [
      0.7,
      1.0
    ],
    "distribution": "uniform over the range (Latin hypercube draws)"
  },
  "status": "assumed",
  "source": {
    "name": "Declared assumption, evidence/assumptions.yaml",
    "doi": null,
    "licence": null,
    "retrieved_utc": null
  },
  "conditions": "E4 quotation research model; every design, context and week",
  "transfer": "No evidence. The walkthrough assumes 1.",
  "versions": {
    "code_commit": "1146349",
    "code_dirty": false,
    "analysis": "experiments/e4_quotation/write_assumption_records.py",
    "model": null
  },
  "disagreements": [],
  "tests": [],
  "declared_utc": "2026-10-02 22:28 UTC",
  "created_utc": "2026-10-03 10:36 UTC",
  "used_by": [
    "gca_sim/quotation"
  ]
}
