{
  "id": "resubmission.bpic2020",
  "mechanism": "A returned declaration is corrected and resubmitted, or abandoned",
  "measures": "Share of 'returned to employee' events followed directly by a new submission, and the elapsed time between them",
  "simulator_parameter": "correction loop: chance a returned item is resubmitted, and time to resubmit",
  "estimable": "yes",
  "value": {
    "unit": "share; days",
    "n": 1365,
    "point": 0.7919,
    "interval_95": [
      0.7696,
      0.8126
    ],
    "interval_95_meaning": "Wilson interval for the resubmission share",
    "summary": {
      "time_to_resubmit": {
        "n": 1081,
        "mean_days": 5.179,
        "median_days": 0.202,
        "median_days_95ci_bootstrap": [
          0.134,
          0.287
        ],
        "p2_5_days": 0.002,
        "p10_days": 0.006,
        "p25_days": 0.027,
        "p75_days": 2.208,
        "p90_days": 11.067,
        "p97_5_days": 44.308,
        "share_under_1_hour": 0.3191,
        "share_over_7_days": 0.136
      }
    }
  },
  "use": "range_only",
  "status": "observed",
  "conditions": "Eindhoven University of Technology travel expense declarations (domestic), 2017 two departments, 2018 whole university; staff anonymised to roles",
  "transfer": "Analogue range for a quote returned to its drafter. Elapsed time includes other work.",
  "source": {
    "name": "BPI Challenge 2020: Domestic Declarations",
    "creator": "Boudewijn van Dongen, Eindhoven University of Technology",
    "doi": "10.4121/uuid:3f422315-ed9d-4882-891f-e180b5b4feb5",
    "url": "https://data.4tu.nl/datasets/6a0a26d2-82d0-4018-b1cd-89afb0e8627f/1",
    "licence": "CC BY-NC 4.0",
    "retrieved_utc": "2026-10-02",
    "file_sha256": "0bc3312acf0b9ee5ae6f4ebe9df204005ef11665d62f2d21dd04995161d7532b"
  },
  "versions": {
    "code_commit": "a342e21",
    "code_dirty": false,
    "analysis": "experiments/e3_bpic2020/run_e3.py",
    "model": null
  },
  "disagreements": [],
  "tests": [],
  "created_utc": "2026-10-02 22:57 UTC"
}
