{
  "id": "unnecessary_escalation.agent_pilot",
  "mechanism": "The agent escalates a quote it could verify",
  "measures": "Escalation rate on tasks where the agreement is visible or the customer has none",
  "simulator_parameter": null,
  "estimable": "partly",
  "estimable_note": "A pilot: few tasks per cell, one model, one prompt, synthetic tasks. The frequency is over valid answers. It constrains the named parameter or product; it does not identify the latent steps behind it.",
  "value": {
    "point": 0.0111,
    "n": 240,
    "summary": {
      "mean_over_tasks": 0.0111,
      "tasks": 30,
      "valid_task_runs": 240,
      "count": 2,
      "missing_task_runs": 0,
      "interval_95_group_bootstrap": [
        0.0,
        0.0333
      ],
      "interval_95_wilson_pooled_ignores_clustering": [
        0.0023,
        0.0299
      ]
    },
    "interval_95": [
      0.0,
      0.0333
    ],
    "interval_95_meaning": "bootstrap over the 5 development groups (crude); the Wilson interval in summary ignores clustering"
  },
  "status": "fitted",
  "use": "range_only",
  "source": {
    "name": "GCA controlled agent pilot (E5), development groups",
    "url": "experiments/agent_pilot/runs/development.jsonl",
    "doi": null,
    "licence": null,
    "retrieved_utc": "2026-10-03",
    "file_sha256": "57af7bb8535c2039f673d2f8e4b5f2a6bff14bd426bc054e443ba179cc54c10d"
  },
  "conditions": "synthetic quotation tasks, one fixed prompt, model qwen/qwen3.8-27b:free through openrouter (host ['modelrun/fp4']), reasoning effort low, 5 development groups, 3 replicates",
  "transfer": "Analogue for the quotation episode: synthetic tasks, one model, one prompt.",
  "versions": {
    "code_commit": "a1f048f",
    "code_dirty": false,
    "analysis": "experiments/agent_pilot/analyse_pilot.py",
    "model": "qwen/qwen3.8-27b:free"
  },
  "disagreements": [],
  "tests": [],
  "created_utc": "2026-10-03 14:32 UTC"
}
