{
  "id": "quotation.effort_lead",
  "mechanism": "Median review capacity a regional lead spends per review (working days the lead's review slot is occupied).",
  "measures": "Nothing measured. A declared assumption.",
  "simulator_parameter": "effort_lead",
  "estimable": "no",
  "estimable_note": "No evidence yet. No estimate planned this round.",
  "value": {
    "unit": "working days",
    "range": [
      0.1,
      1.25
    ],
    "distribution": "uniform over the range (Latin hypercube draws)"
  },
  "status": "assumed",
  "source": {
    "name": "Declared assumption, evidence/assumptions.yaml",
    "doi": null,
    "licence": null,
    "retrieved_utc": null
  },
  "conditions": "E4 quotation research model; every design, context and week",
  "transfer": "No evidence. Lower end about an hour of focused review; upper end is the walkthrough's four reviews a week. The range lets leads be under capacity in some draws and overloaded in others.",
  "versions": {
    "code_commit": "1146349",
    "code_dirty": false,
    "analysis": "experiments/e4_quotation/write_assumption_records.py",
    "model": null
  },
  "disagreements": [],
  "tests": [],
  "declared_utc": "2026-10-02 22:28 UTC",
  "created_utc": "2026-10-03 10:36 UTC",
  "used_by": [
    "gca_sim/quotation"
  ],
  "notes": "Context only, not a bound (review round 3, Codex R3.3): time_to_decision.budget_owner_after_administration.bpic2020, time_to_decision.supervisor_after_administration.bpic2020, time_to_decision.supervisor_after_budget_owner.bpic2020, time_to_decision.supervisor_after_pre_approver.bpic2020"
}
