{
  "id": "later_reviewer_rejection_after_approval.bpic2020",
  "mechanism": "A later reviewer returns a declaration that an earlier reviewer approved",
  "measures": "Share of later-step decisions that are rejections when the previous event was an approval",
  "simulator_parameter": null,
  "estimable": "yes",
  "estimable_note": "Observed disagreement rate between sequential steps. Says nothing about who was right.",
  "value": {
    "table": {
      "BUDGET OWNER after ADMINISTRATION approval": {
        "decisions": 2879,
        "rejected": 59,
        "share": 0.0205,
        "share_95ci_wilson": [
          0.0159,
          0.0263
        ]
      },
      "SUPERVISOR after ADMINISTRATION approval": {
        "decisions": 5323,
        "rejected": 190,
        "share": 0.0357,
        "share_95ci_wilson": [
          0.031,
          0.041
        ]
      },
      "SUPERVISOR after BUDGET OWNER approval": {
        "decisions": 2820,
        "rejected": 32,
        "share": 0.0113,
        "share_95ci_wilson": [
          0.008,
          0.016
        ]
      }
    }
  },
  "status": "observed",
  "conditions": "Eindhoven University of Technology travel expense declarations (domestic), 2017 two departments, 2018 whole university; staff anonymised to roles",
  "transfer": "Weak. Shows sequential reviewers disagree at a low observed rate.",
  "source": {
    "name": "BPI Challenge 2020: Domestic Declarations",
    "creator": "Boudewijn van Dongen, Eindhoven University of Technology",
    "doi": "10.4121/uuid:3f422315-ed9d-4882-891f-e180b5b4feb5",
    "url": "https://data.4tu.nl/datasets/6a0a26d2-82d0-4018-b1cd-89afb0e8627f/1",
    "licence": "CC BY-NC 4.0",
    "retrieved_utc": "2026-10-02",
    "file_sha256": "0bc3312acf0b9ee5ae6f4ebe9df204005ef11665d62f2d21dd04995161d7532b"
  },
  "versions": {
    "code_commit": "a342e21",
    "code_dirty": false,
    "analysis": "experiments/e3_bpic2020/run_e3.py",
    "model": null
  },
  "disagreements": [],
  "tests": [],
  "created_utc": "2026-10-02 22:57 UTC"
}
