{
  "id": "quotation.policy_gate",
  "mechanism": "The system refuses releases beyond the written limits without head-office authorisation",
  "measures": "Nothing measured. A structural assumption.",
  "simulator_parameter": "policy_gate",
  "estimable": "no",
  "estimable_note": "Structural assumption; no evidence.",
  "value": {
    "summary": {
      "main": true,
      "sensitivity": false
    }
  },
  "status": "assumed",
  "source": {
    "name": "Declared assumption, evidence/assumptions.yaml",
    "doi": null,
    "licence": null,
    "retrieved_utc": null
  },
  "conditions": "E4 quotation research model",
  "transfer": "HANDOFF 6 E4 lists no release beyond granted authority among the hard constraints, and the memo says hard rules enforce permissions (review round 3, Codex R3.1). The walkthrough instead lets a lead pass a beyond-limit quote unknowingly (Q12). Which is the main model is Dingying's decision (LAB_LOG Q7); both are run.",
  "versions": {
    "code_commit": "1146349",
    "code_dirty": false,
    "analysis": "experiments/e4_quotation/write_assumption_records.py",
    "model": null
  },
  "disagreements": [],
  "tests": [],
  "declared_utc": "2026-10-02 22:28 UTC",
  "created_utc": "2026-10-03 10:36 UTC",
  "used_by": [
    "gca_sim/quotation"
  ]
}
